{
  "$schema": "http://json-schema.org/draft-07/schema#",
  "$id": "https://aidid.im/schemas/registry/rp-registry.schema.json",
  "title": "AIDID third-party registry snapshot",
  "description": "The shape of https://aidid.im/registry.json (and of its source snapshot `data/rp-registry.json`). Phase 0 is a build-time snapshot maintained by the AIDID project; phase 1 replaces it with a read of the on-chain registry. `origin` is proven with a `/.well-known/aidid-rp.txt` challenge — a declaration, not a trust signal.",
  "type": "object",
  "additionalProperties": false,
  "required": ["schema", "version", "source", "updatedAt", "entries"],
  "properties": {
    "schema": { "const": "aidid.rp-registry" },
    "version": { "const": "1" },
    "source": {
      "type": "string",
      "minLength": 1,
      "description": "Provenance of the snapshot. `/registry.json` reports `data/rp-registry.json`."
    },
    "updatedAt": {
      "type": "string",
      "pattern": "^\\d{4}-\\d{2}-\\d{2}$",
      "description": "YYYY-MM-DD date of the snapshot (not a timestamp)."
    },
    "notes": { "type": "string" },
    "entries": {
      "type": "array",
      "items": { "$ref": "#/$defs/entry" }
    }
  },
  "$defs": {
    "entry": {
      "type": "object",
      "additionalProperties": false,
      "required": ["origin", "name", "homepage", "challenge", "status"],
      "properties": {
        "origin": {
          "type": "string",
          "pattern": "^https://[A-Za-z0-9.-]+(:[0-9]{1,5})?$",
          "description": "Canonical https origin: scheme + host (+ port), no path, no trailing slash, no query/hash/credentials."
        },
        "name": { "type": "string", "minLength": 1 },
        "homepage": {
          "type": "string",
          "pattern": "^https://[A-Za-z0-9.-]+(:[0-9]{1,5})?$",
          "description": "Public homepage for display only — not a trust signal."
        },
        "did": {
          "type": "string",
          "pattern": "^did:msg:[A-Za-z0-9._-]+$",
          "description": "The RP's own did:msg. Recommended today, required from phase 1 on."
        },
        "capabilities": {
          "type": "array",
          "items": { "type": "string", "enum": ["login", "vc-verify", "delegation"] },
          "description": "Declared integrations. Display-only: never a security guarantee."
        },
        "challenge": {
          "type": "string",
          "pattern": "^aidid-rp-verify-[0-9a-f]{16,64}$",
          "description": "Random token the RP must serve at /.well-known/aidid-rp.txt (with or without a trailing newline)."
        },
        "status": { "type": "string", "enum": ["verified", "pending"] },
        "registeredAt": { "type": "string", "pattern": "^\\d{4}-\\d{2}-\\d{2}$" },
        "official": { "type": "boolean", "description": "Maintained by the AIDID project itself." }
      }
    }
  },
  "examples": [
    {
      "schema": "aidid.rp-registry",
      "version": "1",
      "source": "data/rp-registry.json",
      "updatedAt": "2026-10-09",
      "entries": [
        {
          "origin": "https://aidid.im",
          "name": "AIDID",
          "homepage": "https://aidid.im",
          "capabilities": ["login"],
          "challenge": "aidid-rp-verify-1d9a73c8265a1da28a764a631d7f4d40",
          "status": "verified",
          "registeredAt": "2026-10-09",
          "official": true
        }
      ]
    }
  ],
  "x-aidid": {
    "spec": {
      "doc": "frontend/lib/rpRegistry.ts",
      "section": "RP Registry (Phase 0)",
      "version": "1"
    },
    "status": "implemented",
    "source": [
      "frontend/lib/rpRegistry.ts#RpRegistrySnapshot",
      "frontend/scripts/verify-rp-registry.mjs"
    ],
    "enumBindings": [
      { "pointer": "/$defs/entry/properties/capabilities/items/enum", "source": "RP_CAPABILITIES" }
    ],
    "honestLimit": "Phase 0 is a repository snapshot. The on-chain RP registry (phase 1) is not deployed; `scripts/verify-rp-registry.mjs` checks each origin's /.well-known challenge in CI."
  }
}
